{
  "name": "L9 Security Scan",
  "description": "Security scan pipeline (gitleaks, Bandit, Semgrep, pip-audit). Calls l9-ci-core kernel; do not add logic here. LEGACY (frozen @v1) \u2014 see l9-ci-pack/README.md for v2.",
  "iconName": "lock",
  "categories": [
    "Security",
    "CI"
  ],
  "filePatterns": [
    "**/*.py",
    "**/*.js",
    "**/*.ts"
  ]
}
