{
  "name": "L9 Lint and Test (v2, Node/TypeScript)",
  "description": "Node/TypeScript hygiene: SDK Biome scan, tsc --noEmit, package test script. Consumer-owned template, not called by l9-ci-core. Pairs with L9 Analysis (v2) and the locked biome.json contract. See l9-ci-pack/README.md.",
  "iconName": "beaker",
  "categories": [
    "JavaScript",
    "TypeScript",
    "CI"
  ],
  "filePatterns": [
    "**/*.ts",
    "**/*.js"
  ]
}
