{
  "name": "L9 Pre-Commit CI",
  "description": "Pre-commit hook enforcement in CI (ruff, mypy, hooks). Calls l9-ci-core kernel; do not add logic here. LEGACY (frozen @v1) \u2014 see l9-ci-pack/README.md for v2.",
  "iconName": "verified",
  "categories": [
    "Python",
    "CI"
  ],
  "filePatterns": [
    ".pre-commit-config.yaml"
  ]
}
